1905,"Kocalar Wind Power Project, Turkey",Isider Enerji Uretim Pazarlama Ithalat ve Ihracat A.S.,Energy industries (renewable/non-renewable sources),,ACM0002,Registered,Turkey,"58,118",Asia,1/11/2022,3/14/2019,3/13/2029
1906,"Hasanoba Wind Power Project, Turkey",Kovanci Enerji Uretim Pazarlama Ithalat ve Ihracat A.S.,Energy industries (renewable/non-renewable sources),,ACM0002,Registered,Turkey,"87,290",Asia,1/11/2022,9/6/2019,9/5/2029
1907,"Üçpinar Wind Power Project, Turkey",Derbent Enerji Uretim Pazarlama Ithalat ve Ihracat A.S.,Energy industries (renewable/non-renewable sources),,ACM0002,Registered,Turkey,"180,032",Asia,1/11/2022,6/18/2019,6/17/2029
1904,Wind Power Project in Tamil Nadu by Green Infra Renewable Energy Limited,Green Infra Renewable Energy Limited,Energy industries (renewable/non-renewable sources),,ACM0002,Registered,India,"707,515",Asia,9/7/2020,10/8/2018,10/7/2028
1903,VTRM Renewable Energy 2,AUREN ENERGIA S.A.,Energy industries (renewable/non-renewable sources),,ACM0002,Registered,Brazil,"439,950",Latin America,4/6/2020,8/2/2017,8/1/2027
1900,Makame Savannah REDD,Carbon Tanzania,Agriculture Forestry and Other Land Use,REDD,VM0007,Registered,Tanzania,"136,411",Africa,10/2/2020,4/27/2016,4/26/2046
1897,Ntakata Mountains REDD,Carbon Tanzania,Agriculture Forestry and Other Land Use,REDD,VM0007,Registered,Tanzania,"420,200",Africa,9/22/2020,5/19/2017,5/18/2047
1896,Hunan Northern and Northwestern Area Afforestation Project,"Jilin Forest Industry Environmental Technology Co., Ltd.",Agriculture Forestry and Other Land Use,ARR,AR-ACM0003,Registered,China,"286,518",Asia,11/3/2020,5/15/2017,5/14/2057
1893,"18 MW Kemphole Mini Hydel Scheme (KMHS), by International Power Corporation Limited, India",International Power Corporation Limited,Energy industries (renewable/non-renewable sources),,ACM0002,Registered,India,"44,548",Asia,7/29/2019,,
1891,Kishanganga Hydroelectric Project,NHPC Ltd,Energy industries (renewable/non-renewable sources),,ACM0002,Registered,India,"1,563,247",Asia,7/9/2019,3/13/2018,3/12/2028
1892,SOLAR GROUPED PROJECT BY EPSA-CELSIA,Multiple Proponents,Energy industries (renewable/non-renewable sources),,ACM0002; AMS-I.D.,Registered,Colombia,"103,799",Latin America,9/4/2019,9/3/2017,9/2/2027
1890,Grid Connected Solar Energy Project,Apraava Energy Private Limited,Energy industries (renewable/non-renewable sources),,ACM0002,Registered,India,"289,503",Asia,5/8/2019,8/7/2017,8/6/2027
1885,Ejuva One and Ejuva Two Solar Projects,AERA Group,Energy industries (renewable/non-renewable sources),,AMS-I.D.,Registered,Namibia,"26,265",Africa,7/24/2019,9/27/2017,9/26/2027
1884,Bikes for the Planet - Brazil,ZSCORE S. A.,Transport,,AMS-III.BM,Registered,Brazil,167,Latin America,6/4/2020,1/30/2018,1/29/2028
1883,Pichacay Landfill Gas Renewable Energy Project,EMAC-BGP ENERGY COMPANÍA DE ECONOMÍA MIXTA CEM,Energy industries (renewable/non-renewable sources); Waste handling and disposal,,AMS-I.D.; AMS-III.G.,Registered,Ecuador,"33,237",Asia,4/10/2019,7/27/2017,7/26/2027
1881,Conservation of Panama Forests - Reduction of GHG Emissions from Deforestation. Grouped Project,Panamanian Pro Carbon Association (Asociación Panameña Pro Carbono. Approcarbono),Agriculture Forestry and Other Land Use,REDD,VM0015,Registered,Panama,"17,170",Latin America,7/12/2024,10/27/2016,10/26/2046
1877,Thangarabalu Small Hydel Project at Karnataka,Kare Power Resources Private Limited. (KPRPL),Energy industries (renewable/non-renewable sources),,ACM0002,Registered,India,"53,983",Asia,3/12/2021,9/16/2015,9/15/2025
1878,"Bundled renewable energy project in Gujarat and Karnataka, India",Multiple Proponents,Energy industries (renewable/non-renewable sources),,AMS-I.D.,Registered,India,"11,842",Asia,3/20/2019,3/8/2018,3/7/2028
1875,Guangxi Fusui Qiquan biomass power generation project,"Guangxi Fusui Qiquan biomass power generation Co., Ltd.",Energy industries (renewable/non-renewable sources),,ACM0018,Registered,China,"117,822",Asia,3/15/2019,12/11/2018,12/10/2028
1870,Gezin Solar Power Project,Solarges Elektrik Üretim A.Ş,Energy industries (renewable/non-renewable sources),,AMS-I.D.,Registered,Turkey,"3,952",Asia,4/6/2020,1/15/2018,1/14/2028
1874,Zhangjiakou Chabei Wind Farm Project,Credits transferred from approved GHG program,Energy industries (renewable/non-renewable sources),,ACM0002,Withdrawn,China,"203,090",,,,
1869,"Yagual - Carbon Sequestration Grouped Project for the Restoration, Conservation and Sustainable Production in the Guerrero, Sumapaz and Rabanal Paramo Systems",Société de gestion de projets ECOTIERRA Inc.,Agriculture Forestry and Other Land Use,ARR,AR-ACM0003,Registered,Colombia,"13,619",Latin America,6/4/2020,12/19/2018,12/18/2048
1867,Ningxia Xiangshan Wind Farm Project,"Ningxia Zhongwei Aluminum New Energy Co., Ltd",Energy industries (renewable/non-renewable sources),,ACM0002,Registered,China,"727,982",Asia,4/11/2019,4/15/2017,4/14/2027
1868,GUACHICONO SMALL HYDROELECTRIC PROJECT,GELEC GUACHICONO S.A.S .E.S.P,Energy industries (renewable/non-renewable sources),,AMS-I.D.,Registered,Colombia,"20,049",Latin America,3/10/2021,7/1/2021,6/30/2031
1364,Hydroelectric Project PCH Luzma,ISAGEN S.A. E.S.P,Energy industries (renewable/non-renewable sources),,ACM0002,Registered,Colombia,"99,992",Latin America,8/24/2020,10/7/2017,10/6/2027
1862,Bundled Wind Power Project in Gujarat and Tamil Nadu,Multiple Proponents,Energy industries (renewable/non-renewable sources),,AMS-I.D.,Registered,India,"29,987",Asia,2/23/2021,,
1052,North Pikounda REDD+,Multiple Proponents,Agriculture Forestry and Other Land Use,REDD,VM0011,Registered,Congo,"231,110",Africa,10/29/2013,1/1/2012,12/31/2041
1163,Wind Power Project in Tirupur District,NSL WInd Power Company Phoolwadi Private Limited,Energy industries (renewable/non-renewable sources),,ACM0002,Registered,India,"109,306",Asia,4/6/2020,,
1861,3.5MW Manuni Hydro Electric Project in Himanchal Pradesh by Winsome Textile Industries Ltd,Winsome Textile Industries Limited,Energy industries (renewable/non-renewable sources),,AMS-I.D.,Registered,India,"17,619",Asia,7/9/2020,3/31/2017,3/30/2027
1859,Heqing Solar Cooker Project II,"Clean Air Trade, Inc.",Energy industries (renewable/non-renewable sources),,AMS-I.C.,Registered,China,"143,762",Asia,2/14/2019,12/1/2016,11/30/2026
1860,Heqing Solar Cooker Project I,"Clean Air Trade, Inc.",Energy industries (renewable/non-renewable sources),,AMS-I.C.,Registered,China,"143,762",Asia,2/14/2019,,
700,Wind power project at Tamilnadu by Powerica Limited,POWERICA LIMITED,Energy industries (renewable/non-renewable sources),,ACM0002,Registered,India,"32,956",Asia,6/4/2020,,
701,Wind power project at Gujarat by Powerica Limited,POWERICA LIMITED,Energy industries (renewable/non-renewable sources),,AMS-I.D.,Registered,India,"29,443",Asia,4/6/2020,,
1210,Green Energy Project at Kutch by Powerica Limited,POWERICA LIMITED,Energy industries (renewable/non-renewable sources),,ACM0002,Registered,India,"53,122",,4/6/2020,,
1211,Green Energy Project at Gujarat by Powerica Limited,POWERICA LIMITED,Energy industries (renewable/non-renewable sources),,ACM0002,Registered,India,"61,360",,8/4/2014,,
391,"Gullubag 96 MW Hydro Electric Power Plant Project, Turkey",Multiple Proponents,Energy industries (renewable/non-renewable sources),,ACM0002,Registered,Turkey,"144,895",Middle East,4/6/2020,,
1857,Grouped OFF-GRID Renewable Energy Project in India,Multiple Proponents,Energy industries (renewable/non-renewable sources),,AMS-I.F.,Registered,India,"38,366",Asia,4/1/2019,4/1/2017,3/31/2027
1856,Bundled Wind Power Project by Sembcorp Green Infra Limited in India,Green Infra Wind Energy Limited,Energy industries (renewable/non-renewable sources),,ACM0002,Registered,India,"191,006",Asia,5/8/2019,3/2/2017,3/1/2027
1855,Hechu Afforestation Project in Anhui Province,"Hefei Zhuoya Landscaping Engineering Co., Ltd.",Agriculture Forestry and Other Land Use,ARR,AR-ACM0003,Withdrawn,China,"469,187",Asia,6/4/2020,4/22/2014,4/21/2034
1854,20 MWAC (22 MWDC) SKCIL SOLAR POWER PLANT PROJECT,Shri Keshav Cements & Infra Ltd.,Energy industries (renewable/non-renewable sources),,ACM0002,Registered,India,"33,707",Asia,4/23/2020,4/1/2018,3/31/2028
1853,9.9 MW Wind Power Project by KPL International Ltd. in Gujarat,KPL International Limited,Energy industries (renewable/non-renewable sources),,AMS-I.D.,Registered,India,"24,232",Asia,1/17/2019,2/28/2017,2/27/2027
794,Dahao Wind Power Project,"China Resources Windpower Development (Shantou Haojiang) Co., Ltd.",Energy industries (renewable/non-renewable sources),,ACM0002,Registered,China,"40,000",Asia,4/6/2020,,
1852,"Northern Fuel Pipeline Transportation Project, Thailand",Multiple Proponents,Transport,,AM0110,Registered,Thailand,"29,180",Asia,11/10/2020,5/1/2019,4/30/2029
728,CECIC Gansu Yumen Changma No.3 Wind Farm Project,"CECIC Wind-power (Gansu) Co., Ltd.",Energy industries (renewable/non-renewable sources),,ACM0002,Registered,China,"348,411",Asia,4/6/2020,,
1842,100 MW SOLAR PROJECT IN BHADLA IN RAJASTHAN.,Clean Sustainable Energy Pvt. Ltd.,Energy industries (renewable/non-renewable sources),,ACM0002,Registered,India,"176,539",Asia,1/3/2019,9/16/2018,9/15/2028
1843,100 MW SOLAR BY GIRIRAJ RENEWABLES PVT. LTD.- SATARA.,Giriraj Renewables Private Limited,Energy industries (renewable/non-renewable sources),,ACM0002,Withdrawn,India,"135,329",Asia,,4/16/2018,4/15/2028
1844,80 MW SOLAR BY FERMI SOLAR FARMS PVT LTD - CHALISGAON.,Fermi Solar Farms Pvt. Ltd.,Energy industries (renewable/non-renewable sources),,ACM0002,Registered,India,"206,705",Asia,12/31/2018,4/14/2018,4/13/2028
1845,30 MW SOLAR BY AVAADA SUSTAINABLE ENERGY PVT LTD – HANAGAL.,Avaada Sustainable Energy Pvt. Ltd.,Energy industries (renewable/non-renewable sources),,ACM0002,Withdrawn,India,"43,825",,,,
1846,30 MW SOLAR BY SOLARSYS NON CONVENTIONAL ENERGY PVT. LTD. - BANAVIKAL.,Solarsys Non conventional Energy Pvt. Ltd.,Energy industries (renewable/non-renewable sources),,ACM0002,Withdrawn,India,"43,825",,,,
1841,Santa Teresa Hydropower Plant,INLAND ENERGY,Energy industries (renewable/non-renewable sources),,ACM0002,Registered,Peru,"293,121",Latin America,4/6/2020,9/1/2015,8/31/2025
1840,Ovejería Photovoltaic Power Plant,Colbun S.A.,Energy industries (renewable/non-renewable sources),,AMS-I.D.,Registered,Chile,"13,103",Latin America,4/6/2020,5/25/2018,5/24/2028
693,"Erkenek 12 MW Hydropower Plant, Turkey",Tektuð Elektrik Üretim A.Þ.,Energy industries (renewable/non-renewable sources),,ACM0002; AMS-I.D.,Registered,Turkey,"32,195",Middle East,4/6/2020,2/26/2019,2/25/2029
1834,60 MW Solar by Solarsys Non Conventional Energy Pvt. Ltd. - Ilkal.,WeAct Pty Ltd,Energy industries (renewable/non-renewable sources),,ACM0002,Withdrawn,India,"87,651",Asia,,3/31/2018,3/30/2028
1831,"Wind Energy Project at Devbhoomi Dwaraka,Gujarat by Powerica Limited",POWERICA LIMITED,Energy industries (renewable/non-renewable sources),,ACM0002,Registered,India,"42,210",Asia,3/21/2019,,
1197,Chakala Wind Power Project in Maharashtra,M/s Bindu Vayu Urja Private Limited,Energy industries (renewable/non-renewable sources),,ACM0002,Registered,India,"74,307",Asia,7/17/2014,,
1830,Wind Power Project at Theni by Powerica Limited,POWERICA LIMITED,Energy industries (renewable/non-renewable sources),,AMS-I.D.,Registered,India,"21,864",Asia,11/28/2018,,
1826,Qinghai Afforestation Project,"Qinghai Forestry Ecological Construction and Investment Co., Ltd.",Agriculture Forestry and Other Land Use,ARR; IFM; REDD,AR-ACM0003,Registered,China,"766,948",Asia,4/6/2020,4/21/2014,4/20/2114
1824,"Liucheng Biomass Power Generation Project in Guangxi Zhuang Autonomous Region, China","Liuzhou City Xin’neng Biomass Power Generation Co., Ltd.",Energy industries (renewable/non-renewable sources),,ACM0006,Registered,China,"58,277",Asia,4/6/2020,,
1821,Conservación de los Ecosistemas y el Almacén de Carbono Región de Transición Guayano Amazónica 'Flor de Inírida',Ciprogress Greenlife,Agriculture Forestry and Other Land Use,REDD,VM0007,Withdrawn,Colombia,"7,627,523",Latin America,,1/1/2017,12/31/2116
1822,10 MW wind power project by Powerica at BDS - Gujarat,POWERICA LIMITED,Energy industries (renewable/non-renewable sources),,AMS-I.D.,Registered,India,"24,816",Asia,10/17/2019,2/4/2017,2/3/2027
1823,"21.8 MW Wind Power Project at Jangi Vandhiya, Gujarat by Powerica Limited",POWERICA LIMITED,Energy industries (renewable/non-renewable sources),,ACM0002,Registered,India,"50,207",Asia,11/21/2018,,
1819,"19.2 MWp Solar Power Project by HZL at Debari and Dariba, Rajasthan",Hindustan Zinc Limited,Energy industries (renewable/non-renewable sources),,ACM0002,Withdrawn,India,"23,859",Asia,10/17/2019,3/25/2017,3/24/2027
1820,Manantiales Behr Wind Farm,YPF Energia Electrica S.A.,Energy industries (renewable/non-renewable sources),,ACM0002,Registered,Argentina,"251,000",Latin America,4/17/2019,8/1/2018,7/31/2028
1814,"Wind Power Project in Gujarat, India",Vish Wind Infrastructure LLP,Energy industries (renewable/non-renewable sources),,ACM0002,Rejected by Administrator,India,"57,170",Asia,,,
1815,Renewable Solar Power Project by Adani Green Energy Limited,Adani Green Energy Limited,Energy industries (renewable/non-renewable sources),,ACM0002,Registered,India,"1,553,021",Asia,10/17/2019,9/28/2017,9/27/2027
1816,Wind power project in Tirunelveli Tamilnadu,Vaayu Renewable Energy (Tapti) Private Limited,Energy industries (renewable/non-renewable sources),,AMS-I.D.,Registered,India,"16,347",Asia,4/17/2020,12/2/2017,12/1/2027
345,Wind power project by HZL in Karnataka.,Hindustan Zinc Limited,Energy industries (renewable/non-renewable sources),,ACM0002,Withdrawn,India,"65,036",Asia,3/9/2010,,
344,Wind power project by HZL in Gujarat.,Hindustan Zinc Limited,Energy industries (renewable/non-renewable sources),,ACM0002,Withdrawn,India,"158,127",Asia,4/6/2020,,
120,Aydin Salavatli Dora-1 Geothermal Power Plant,Menderes Geothermal Elektrik Uretim A.S,Energy industries (renewable/non-renewable sources),,AMS-I.D.,Registered,Turkey,"30,309",Middle East,3/9/2023,7/1/2018,6/30/2028
1811,Jari/Pará REDD+ Project,Multiple Proponents,Agriculture Forestry and Other Land Use,REDD,VM0015,Registered,Brazil,"525,314",Latin America,4/6/2020,7/8/2014,7/7/2044
1812,VTRM Renewable Energy,AUREN ENERGIA S.A.,Energy industries (renewable/non-renewable sources),,ACM0002,Registered,Brazil,"409,442",Latin America,4/6/2020,12/9/2016,12/8/2026
1150,Algoma Highlands Conservancy Improved Forest Management Project,Algoma Highlands Conservancy,Agriculture Forestry and Other Land Use,IFM,VM0010,Withdrawn,Canada,"1,820",North America,,11/30/2009,11/29/2029
1807,"Biomass based thermal energy generation project by Dynamic Fine Paper Mill at Polai Kalan, Deegod, Kota",Dynamic Fine Paper Mill Pvt. Ltd.,Energy industries (renewable/non-renewable sources),,AMS-I.C.,Registered,India,"43,938",Asia,10/15/2018,11/21/2016,11/20/2026
1805,Solar Energy Project(s) by SB Energy Private Limited,Adani Renewable Energy Devco Private Limited,Energy industries (renewable/non-renewable sources),,ACM0002,Registered,India,"4,354,646",Asia,9/24/2018,2/27/2017,2/26/2027
1804,Combio Renewable Biomass Project - Três Marias,Combio Energia S.A.,Energy industries (renewable/non-renewable sources),,AMS-I.C.,Registered,Brazil,"58,519",Latin America,3/11/2019,4/1/2017,3/31/2027
1195,Wind Power Project in Rajasthan,Mytrah Energy (INDIA) Ltd.,Energy industries (renewable/non-renewable sources),,ACM0002,Registered,India,"70,677",Asia,4/6/2020,,
1190,Wind power project in Gujarat,Mytrah Energy (India) Limited,Energy industries (renewable/non-renewable sources),,ACM0002,Registered,India,"48,273",Asia,4/6/2020,,
1800,12 MW Raura Hydro Project by DLI Power,DLI Power (India) Private Limited,Energy industries (renewable/non-renewable sources),,AMS-I.D.,Registered,India,"38,464",Asia,2/25/2021,9/9/2019,9/8/2029
1798,Hydroelectric projects at Oibita River,PCH San Bartolomé S.A.S .ES.P.,Energy industries (renewable/non-renewable sources),,ACM0002,Registered,Colombia,"100,508",Latin America,10/2/2020,9/1/2020,8/31/2030
1796,Santa Rosa-Altamira hydroelectric projects,Desarrollo de Energías Renovables S.A.S .ES.P.,Energy industries (renewable/non-renewable sources),,ACM0002,Registered,Colombia,"99,804",Latin America,11/23/2020,7/1/2020,6/30/2030
1797,El Molino-San Matias hydroelectric projects,Multiple Proponents,Energy industries (renewable/non-renewable sources),,ACM0002,Registered,Colombia,"90,393",Latin America,4/6/2020,4/17/2017,4/16/2027
1794,Interwaste Landfill gas Grouped Project,Interwaste (Pty) Ltd,Energy industries (renewable/non-renewable sources); Waste handling and disposal,,ACM0001,Registered,South Africa,"41,396",Africa,4/6/2020,10/28/2016,10/27/2026
1787,Renewable Power Project by Animala Wind Power Private Limited,Animala Wind Power Private Limited,Energy industries (renewable/non-renewable sources),,ACM0002,Registered,India,"163,843",Asia,5/21/2019,3/30/2017,3/29/2027
1788,Renewable Power Project by Saipuram Wind Energies Private Limited,Saipuram Wind Energies Private Limited,Energy industries (renewable/non-renewable sources),,ACM0002,Registered,India,"266,287",Asia,8/14/2018,3/31/2017,3/30/2027
1789,Renewable Power Project by SEI Kathiravan Power Private Limited,SEI Kathiravan Power Private Limited,Energy industries (renewable/non-renewable sources),,ACM0002,Registered,India,"77,356",Asia,8/19/2019,3/9/2017,3/8/2027
1790,Renewable Power Project by Axis Wind Farms (MPR Dam) Private Limited,Axis Wind Farms (MPR Dam) Private Limited,Energy industries (renewable/non-renewable sources),,ACM0002,Registered,India,"195,052",Asia,8/14/2018,3/30/2017,3/29/2027
1791,Pavagada Solar Renewable Power Project by Greenko Group,SEI Suryashakti Power Private Limited,Energy industries (renewable/non-renewable sources),,ACM0002,Registered,India,"139,239",Asia,8/19/2019,3/30/2017,3/29/2027
1792,Ghani Solar Renewable Power Project by Greenko Group,Zuvan Energy Private Limited,Energy industries (renewable/non-renewable sources),,ACM0002,Registered,India,"996,010",Asia,8/14/2018,3/31/2017,3/30/2027
1793,Renewable Power Project by Devarahipparigi Wind Power Private Limited,Devarahipparigi Wind Power Private Limited,Energy industries (renewable/non-renewable sources),,ACM0002,Registered,India,"195,052",Asia,12/10/2018,3/25/2017,3/24/2027
1782,"Solar PV Power Project by Prayatna Developers Pvt. Ltd. at Bhatinda, Punjab",Prayatna Developers Private Limited,Energy industries (renewable/non-renewable sources),,ACM0002,Registered,India,"167,973",Asia,8/2/2018,9/17/2016,9/16/2026
1783,72 MWac Ramnad Renewable Energy Project,Ramnad Renewable Energy Ltd,Energy industries (renewable/non-renewable sources),,ACM0002,Registered,India,"115,817",Asia,8/2/2018,9/18/2016,9/17/2026
1784,Solar Power Project by Mytrah Energy India Private Limited,JSW NEO ENERGY LIMITED,Energy industries (renewable/non-renewable sources),,ACM0002,Registered,India,"638,520",Asia,4/6/2020,6/19/2017,6/18/2027
1786,Solar Photovoltaic Project by Giriraj Renewables Private Limited,Avaada Energy Private Limited,Energy industries (renewable/non-renewable sources),,ACM0002,Registered,India,"234,677",Asia,7/29/2020,3/2/2018,3/1/2028
1781,MRMPL Wind Power Project,Modern Road Makers Pvt Ltd.,Energy industries (renewable/non-renewable sources),,ACM0002,Withdrawn,India,"32,788",Asia,2/8/2018,,
250,"Bundled Wind Power Project in Tamil Nadu, India, Co-ordinated by Tamil Nadu Spinning Mills Association(TASMA-V1)",TAMILNADU SPINNING MILLS ASSOCIATION (TASMA),Energy industries (renewable/non-renewable sources),,ACM0002,Registered,India,"82,064",Asia,4/6/2020,,
799,Bukaleba Forest Project,Busoga Forestry Co. Ltd (Subsidiary Green Resources),Agriculture Forestry and Other Land Use,ARR,AR-ACM0001,Registered,Uganda,"11,903",Africa,3/20/2012,3/11/2004,3/10/2046
1778,Lahendong Unit 5 & Unit 6 Geothermal Project,Multiple Proponents,Energy industries (renewable/non-renewable sources),,ACM0002,Withdrawn,Indonesia,"181,030",Asia,7/17/2018,9/15/2016,9/14/2026
1774,Grid-connected Solar PV project in Bokhol,Senergy 2 SAS,Energy industries (renewable/non-renewable sources),,ACM0002,Registered,Senegal,"28,130",Africa,4/13/2020,11/11/2016,11/10/2026
1776,Wind Power Project by Green Infra Wind Power Generation Limited,Green Infra Wind Power Generation Limited,Energy industries (renewable/non-renewable sources),,ACM0002,Registered,India,"79,147",Asia,12/10/2020,8/12/2016,8/11/2026
1772,Solar and Wind Power Project by NTPC Limited,NTPC GREEN ENERGY LIMITED,Energy industries (renewable/non-renewable sources),,ACM0002,Registered,India,"940,891",Asia,6/29/2018,8/10/2016,8/9/2026
198,J L Silva Ceramic Fuel Switching Project,Multiple Proponents,Energy industries (renewable/non-renewable sources),,AMS-I.E.,Registered,Brazil,"20,941",Latin America,4/6/2020,10/1/2016,9/30/2026
34,Cavalcante Ceramic fuel switching project,Multiple Proponents,Energy industries (renewable/non-renewable sources),,AMS-I.E.,Registered,Brazil,"17,139",Latin America,4/6/2020,1/1/2017,12/31/2026
1771,46 MW Mangoli Wind Power Project in Karnataka,Vena Energy KN Wind Power Private Limited,Energy industries (renewable/non-renewable sources),,ACM0002,Registered,India,"120,268",Asia,8/13/2019,7/23/2016,7/22/2026
1770,Bundled Solar Power Project by Vector Green Energy Private Limited,Multiple Proponents,Energy industries (renewable/non-renewable sources),,ACM0002,Registered,India,"163,888",Asia,4/6/2020,6/28/2016,6/27/2026
1769,"Grouped Project for restoration of degraded lands in Jaguar Corridors, Colombia",Multiple Proponents,Agriculture Forestry and Other Land Use,IFM; REDD,VM0005; AR-ACM0003,Registered,Colombia,"6,835",Latin America,8/30/2019,9/1/2015,8/31/2055
1768,216 MWac Kamuthi Solar Power Project,Kamuthi Solar Power Limited,Energy industries (renewable/non-renewable sources),,ACM0002,Registered,India,"346,117",Asia,4/13/2020,9/18/2016,9/17/2026
764,Yunnan Maguan Laqi Hydropower Project,"Maguan Laqi Power Generation Co., Ltd.",Energy industries (renewable/non-renewable sources),,ACM0002,Registered,China,"174,517",Asia,4/6/2020,8/17/2008,8/16/2029
1767,Bundled Solar Power Project by Mahindra Susten Private Limited,Multiple Proponents,Energy industries (renewable/non-renewable sources),,ACM0002,Registered,India,"329,360",Asia,5/16/2019,6/29/2016,6/28/2026
1766,Outapi Pv Plant,AERA Group,Energy industries (renewable/non-renewable sources),,AMS-I.D.,Registered,Namibia,"10,372",Africa,5/26/2022,7/1/2018,6/30/2028
1765,Grouped Project for reducing emissions from deforestation and forest degradation-REDD-in the Regional Natural Park:Biological Corridor PNN Purace-PNN Cueva de los Guacharos,Corporación Autónoma Regional del Río Grande de la Magdalena (CORMAGDALENA),Agriculture Forestry and Other Land Use,REDD,VM0015,Registered,Colombia,"117,468",Latin America,12/7/2021,3/8/2014,3/7/2044
1181,CGN Inner Mongolia Zhurihe Phase II Wind Farm Project,"CGN Wind Power Co., Ltd.",Energy industries (renewable/non-renewable sources),,ACM0002,Registered,China,"119,319",Asia,2/1/2014,,
1182,CGN Inner Mongolia Zhurihe Phase I Wind Farm Project,"CGN Wind Power Co., Ltd.",Energy industries (renewable/non-renewable sources),,ACM0002,Registered,China,"130,755",,1/14/2014,,
1183,Xinjiang Jimunai CGN Phase I Wind Farm Project,"Xinjiang Jimunai CGN Wind Power Co., Ltd.",Energy industries (renewable/non-renewable sources),,ACM0002,Registered,China,"107,695",Asia,12/27/2013,,
1759,Methane Recovery and Power Generation Project at ESIPL,Everest Starch India Pvt. Ltd.,Energy industries (renewable/non-renewable sources); Waste handling and disposal,,AMS-I.F.; AMS-III.H.,Registered,India,"52,036",Asia,4/13/2020,9/18/2016,9/17/2026
1760,The Haidar EL ALI Mangrove Initiative (HEAMI),Multiple Proponents,Agriculture Forestry and Other Land Use,ARR,AR-AMS0003,Withdrawn,Senegal,"30,170",Africa,,8/1/2018,7/31/2048
1758,Dereli Hydroelectric Power  Plant,Aydem Yenilenebilir Enerji A.S.,Energy industries (renewable/non-renewable sources),,ACM0002,Registered,Turkey,"83,983",Asia,4/25/2018,,
766,Teesta- V Hydro Power project in Sikkim,NHPC Ltd,Energy industries (renewable/non-renewable sources),,ACM0002,Registered,India,"2,044,442",Asia,4/6/2020,,
1753,Bundled Solar Photovoltaic Project by ACME,Multiple Proponents,Energy industries (renewable/non-renewable sources),,ACM0002; AMS-I.D.,Registered,India,"2,078,589",Asia,4/6/2020,2/10/2017,2/9/2027
1754,"Reading Wind Energy, LLC",Southern Power Company,Energy industries (renewable/non-renewable sources),,ACM0002,Registered,United States,"512,840",North America,7/20/2018,5/21/2020,5/20/2030
249,"Bundled Wind Power Project in Tamilnadu, India, Co-ordinated by Tamilnadu Spinning Mills Association(TASMA-II)",TAMILNADU SPINNING MILLS ASSOCIATION (TASMA),Energy industries (renewable/non-renewable sources),,ACM0002,Registered,India,"758,093",Asia,4/6/2020,,
1748,Southern Cardamom REDD+ Project,"Royal Government of Cambodia (RGC), Ministry of Environment",Agriculture Forestry and Other Land Use,REDD,VM0009,Registered,Cambodia,"3,867,568",Asia,4/6/2020,1/1/2015,12/31/2044
974,"Sarbari II hydro power project by DSL Hydrowatt Limited in Kullu, Himachal Pradesh",DSL HYDROWATT PRIVATE LIMITED,Energy industries (renewable/non-renewable sources),,AMS-I.D.,Registered,India,"28,635",Asia,4/6/2020,,
483,"Sarbari-I small hydro project of DSL Hydrowatt Limited (DSLHL), Himachal Pradesh, India",DSL HYDROWATT PRIVATE LIMITED,Energy industries (renewable/non-renewable sources),,AMS-I.D.,Registered,India,"23,425",Asia,4/6/2020,,
1746,108 MW Fatanpur Wind Power Project in Madhya Pradesh,Multiple Proponents,Energy industries (renewable/non-renewable sources),,ACM0002,Registered,India,"212,745",Asia,3/9/2018,3/11/2016,3/10/2026
