2535,Skyridge Farms Advanced Solid Separation Project,Skyridge Farms,"Livestock, enteric fermentation, and manure management",,AMS-III.Y; VMR0003,Registered,United States,"10,000",North America,5/8/2023,10/23/2019,10/22/2026
2527,Maesod Wastewater Treatment and Biogas Utilisation Project,Thai Wah Public Company Limited,Energy industries (renewable/non-renewable sources); Waste handling and disposal,,AMS-I.C.; AMS-I.D.; AMS-III.H.,Registered,Thailand,"53,241",Asia,12/2/2024,3/22/2020,3/21/2027
2525,Ziyang LFG Power Generation Project,Ziyang Oasis Xinzhongshui Environmental Protection Technology Co. Ltd.,Energy industries (renewable/non-renewable sources); Waste handling and disposal,,ACM0001,Registered,China,"81,291",Asia,3/29/2022,3/15/2020,3/14/2030
2521,Installation of high efficiency wood burning cookstoves in Laos,Bridge Carbon SGT Asia Stoves Private Limited,Energy demand; Energy industries (renewable/non-renewable sources),,VMR0006,Registered,Lao,"373,095",Asia,7/11/2022,5/4/2022,5/3/2032
2522,Installation of high efficiency wood burning cookstoves in Thailand,Bridge Carbon SGT Asia Stoves Private Limited,Energy demand,,VMR0006,Registered,Thailand,"1,900,000",Asia,12/21/2022,6/22/2021,6/21/2031
2523,Installation of high efficiency wood burning cookstoves in Vietnam,Bridge Carbon SGT Asia Stoves Private Limited,Energy demand,,VMR0006,Registered,Viet Nam,"590,000",Asia,1/19/2023,11/4/2021,11/3/2031
2520,Nanjing Landsea Green Center Building Energy Efficiency Project,Nanjing Langtong Commercial Real Estate Operation Management Co. Ltd.,Energy demand; Energy industries (renewable/non-renewable sources),,AMS-II.E.,Registered,China,"1,442",Asia,3/25/2022,6/1/2022,5/31/2032
2512,"AFFORESTATION OF DEGRADED GRASSLANDS IN VICHADA, COLOMBIA",Forest First Colombia S.A.S.,Agriculture Forestry and Other Land Use,ARR,AR-ACM0003,Registered,Colombia,"139,489",Latin America,5/25/2022,9/15/2016,9/14/2046
2514,PADAS Energy Biogas Plant,Multiple Proponents,Waste handling and disposal,,AM0073,Registered,Turkey,"247,871",Middle East,4/13/2022,10/18/2019,10/17/2026
2516,Lianyuan LFG Power Generation Project,"Lianyuan Xinzhongshui Environmental Protection Technology Co., Ltd.",Energy industries (renewable/non-renewable sources); Waste handling and disposal,,AMS-I.D.; AMS-III.G.,Registered,China,"40,563",Asia,3/4/2022,1/1/2021,12/31/2030
2510,"CHINKO CONSERVATION AREA REDD+ PROJECT, CENTRAL AFRICAN REPUBLIC",African Parks RCA,Agriculture Forestry and Other Land Use,REDD,VM0009,Registered,Central African Republic,"398,553",Africa,11/28/2023,9/15/2016,9/14/2044
2504,Adjusted Water Management in Rice Cultivation in Xuanzhou District,"Hefei Luyu Agricultural Technology Co., Ltd",Agriculture Forestry and Other Land Use,ALM,AMS-III.AU,Rejected by Administrator,China,"58,064",Asia,12/23/2021,,
2505,Fuel Efficient Cooking in South Africa,TASC SA (Pty) Ltd.,Energy demand,,VMR0006,Registered,South Africa,"103,847",Africa,3/9/2022,8/20/2021,8/19/2031
2506,Adjusted Water Management in Rice Cultivation In Northern Lujiang County,"Hefei Luyu Agricultural Technology Co., Ltd",Agriculture Forestry and Other Land Use,ALM,AMS-III.AU,Rejected by Administrator,China,"59,282",Asia,9/14/2021,,
2507,Adjusted Water Management in Rice Cultivation In Southern Lujiang County,"Hefei Luyu Agricultural Technology Co., Ltd",Agriculture Forestry and Other Land Use,ALM,AMS-III.AU,Rejected by Administrator,China,"59,043",Asia,9/14/2021,,
2503,Liling LFG Power Generation Project,"Zhuzhou Xinzhongshui Environmental Protection Technology Co., Ltd.",Energy industries (renewable/non-renewable sources); Waste handling and disposal,,ACM0001,Registered,China,"96,472",Asia,10/29/2021,10/12/2020,10/11/2030
2499,Guangzhou Huadu Shiling LFG Power Generation Project,"Guangzhou Zhongshui Recycling Environmental Protection Technology Co., Ltd.",Waste handling and disposal,,ACM0001,Registered,China,"29,193",Asia,8/6/2021,1/9/2020,1/8/2030
2498,Afforestation of degraded grasslands in Caazapa and Guairá,Miller Forest Investment AG,Agriculture Forestry and Other Land Use,ARR,AR-ACM0003,Registered,Paraguay,"204,819",Latin America,1/14/2022,1/13/2016,1/12/2046
2496,IMPACT REFORESTATION IN THE CHACO PROJECT,Multiple Proponents,Agriculture Forestry and Other Land Use,ARR,AR-ACM0003,Registered,Paraguay,254,Latin America,11/22/2023,1/1/2022,12/31/2051
2497,"TIST Program in Uganda, VCS-CCB 011",Clean Air Action Corporation,Agriculture Forestry and Other Land Use,ARR,AR-ACM0003,Registered,Uganda,"121,978",Africa,6/20/2024,12/16/2003,12/15/2063
2489,Viet Nam Improved Cookstove Project by KCM – Improved Cookstove Project in Hoa Binh Province – CPA 002,Korea Carbon Management Ltd,Energy demand,,AMS-II.G.,Registered,Viet Nam,"37,643",Asia,10/3/2022,6/27/2019,6/26/2029
2490,Viet Nam Improved Cookstove Project by KCM – Improved Cookstove Project in Phu Tho Province – CPA 003,Korea Carbon Management Ltd,Energy demand,,AMS-II.G.,Registered,Viet Nam,"46,339",Asia,11/22/2022,6/27/2019,6/26/2029
2491,Viet Nam Improved Cookstove Project by KCM – Improved Cookstove Project in Phu Tho Province – CPA 004,Korea Carbon Management Ltd,Energy demand,,AMS-II.G.,Registered,Viet Nam,"45,952",Asia,1/17/2023,6/28/2019,6/27/2029
2492,Viet Nam Improved Cookstove Project by KCM – Improved Cookstove Project in Thai Nguyen Province – CPA 005,Korea Carbon Management Ltd,Energy demand,,AMS-II.G.,Registered,Viet Nam,"45,650",Asia,1/9/2023,6/21/2019,6/20/2029
2493,Viet Nam Improved Cookstove Project by KCM – Improved Cookstove Project in Thai Nguyen Province – CPA 006,Korea Carbon Management Ltd,Energy demand,,AMS-II.G.,Registered,Viet Nam,"44,314",Asia,1/9/2023,6/28/2019,6/27/2029
2487,Viet Nam Improved Cookstove Project by KCM – Improved Cookstove Project in Hoa Binh Province – CPA 001,Korea Carbon Management Ltd,Energy demand,,AMS-II.G.,Registered,Viet Nam,"44,888",Asia,8/4/2022,4/26/2019,4/25/2029
2485,Agri-SMART: Sustaining a resilient and inclusive development in Zambezia,Carbon Sink Group s.r.l.,Agriculture Forestry and Other Land Use,ALM,VM0017,Registered,Mozambique,163,Africa,6/12/2023,12/10/2020,12/9/2040
2479,Mahogany Plantation in India,Mahogani Vishwa Agro Pvt Ltd,Agriculture Forestry and Other Land Use,ARR,AR-ACM0003,Registered,India,"8,446",Asia,11/20/2023,6/28/2019,6/27/2049
2481,Generation Forest Group Project,"Futuro Forestal, S.A.",Agriculture Forestry and Other Land Use,ARR,AR-ACM0003,Registered,Panama,"27,000",Latin America,3/17/2022,8/15/2016,8/14/2116
2482,Boa Fé REDD Project,Multiple Proponents,Agriculture Forestry and Other Land Use,REDD,VM0015,Withdrawn,Brazil,"1,601,653",Latin America,,1/1/2020,12/31/2049
2476,Huaining Adjusted Water Management in Rice Cultivation,"Hefei Luyu Agricultural Technology Co., Ltd",Agriculture Forestry and Other Land Use,ALM,AMS-III.AU,Rejected by Administrator,China,"58,041",Asia,9/14/2021,,
2477,Wanfan Adjusted Water Management in Rice Cultivation,"Hefei Luyu Agricultural Technology Co., Ltd",Agriculture Forestry and Other Land Use,ALM,AMS-III.AU,Rejected by Administrator,China,"59,986",Asia,9/14/2021,,
2474,Fujian Shunchang IFM (conversion of logged to protected forest) Project,Fujian Shunchang State-owned Forest Farm,Agriculture Forestry and Other Land Use,IFM,VM0010,Rejected by Administrator,China,"23,176",Asia,,1/1/2017,12/31/2046
2473,Installation of High Efficient Cook Stoves by Enking International,EKI Energy Services Limited,Energy demand,,VMR0006,Registered,India,"86,825",Asia,6/9/2022,10/16/2019,10/15/2026
2471,Agroforestry and reforestation with small-scale farmers in Uganda,The PURE PROJECT SAS,Agriculture Forestry and Other Land Use,ARR,AR-AMS0007,Registered,Uganda,"1,214",Africa,7/26/2023,4/13/2016,4/12/2051
2469,Afforestation and restoration of degraded forests in Eastern Paraguay or Forestal Azul Carbon Project,Forestal Azul S.A.,Agriculture Forestry and Other Land Use,ARR,AR-ACM0003,Registered,Paraguay,"14,248",Latin America,3/15/2023,6/1/2018,5/31/2028
2468,Gaizhou Landfill Gas Power Generation Project,"Gaizhou Xinzhongshui Environmental Protection Technology Co., Ltd.",Energy industries (renewable/non-renewable sources); Waste handling and disposal,,ACM0001,Registered,China,"128,590",Asia,7/23/2021,1/5/2021,1/4/2031
2466,"BUNDLED WIND POWER PROJECT IN TAMILNADU, INDIA CO-ORDINATED BY THE TAMILNADU SPINNING MILLS ASSOCIATION (TASMA.)",TAMILNADU SPINNING MILLS ASSOCIATION (TASMA),Energy industries (renewable/non-renewable sources),,ACM0002,Rejected by Administrator,India,"801,520",Asia,,,
2461,Convergence Energy Services Ltd. (CESL) EV Charging Infrastructure Project,Convergence Energy Services Limited,Energy distribution; Energy industries (renewable/non-renewable sources); Transport,,VM0038,Registered,India,"12,334",Asia,1/3/2024,4/12/2019,4/11/2029
2460,GZL ENERGY BIOGAS PLANT,Multiple Proponents,"Energy industries (renewable/non-renewable sources); Livestock, enteric fermentation, and manure management; Waste handling and disposal",,AMS-I.D.; AMS-III.D.,Registered,Turkey,"52,348",Middle East,8/2/2021,6/30/2019,6/29/2029
2459,NAYA REDD+,Multiple Proponents,Agriculture Forestry and Other Land Use,REDD,VM0007,Rejected by Administrator,Colombia,"307,252",Latin America,1/2/2024,11/26/2015,11/25/2035
2458,Guoluo Grassland Sustainable Management Project,"Qinghai Guanglv Landscaping Co., Ltd.",Agriculture Forestry and Other Land Use,ARR,VM0026,Registered,China,"456,953",Asia,12/18/2021,6/20/2016,6/19/2056
2455,Haicheng Landfill Gas Power Generation Project,"Haicheng Xinzhongshui Environmental Protection Technology Co., Ltd",Energy industries (renewable/non-renewable sources); Waste handling and disposal,,ACM0001,Registered,China,"81,914",Asia,8/5/2021,9/9/2019,9/8/2029
2457,BYZ GLOBAL ENERGY BIOGAS PLANT,Multiple Proponents,"Energy industries (renewable/non-renewable sources); Livestock, enteric fermentation, and manure management; Waste handling and disposal",,AMS-I.D.; AMS-III.D.,Registered,Turkey,"50,576",Middle East,12/27/2021,7/30/2019,7/29/2029
2452,Laizhou Landfill Gas Power Generation Project,"Laizhou Xinzhongshui Environmental Protection Technology Co., Ltd.",Energy industries (renewable/non-renewable sources); Waste handling and disposal,,ACM0001,Registered,China,"78,184",Asia,6/24/2021,5/18/2019,5/17/2029
2450,Starsight Energy - Rooftop Solar PV and Efficient Air Conditioners,Starsight Power Utility Limited,Energy demand; Energy industries (renewable/non-renewable sources),,AMS-I.F.; AMS-II.E.,Registered,Nigeria,"4,142",Africa,9/29/2021,7/3/2019,7/2/2026
2451,Shanxi Loufan Afforestation Project,Loufan County Forestry Workstation,Agriculture Forestry and Other Land Use,ARR,AR-ACM0003,Registered,China,"163,968",Asia,12/1/2021,9/30/2016,9/29/2076
2449,Tradewater International Dominican Republic,Tradewater International SRL,Fugitive emissions from production and consumption of halocarbons and sulphur hexafluoride,,VM0016,Registered,Dominican Republic,"4,000",Latin America,6/18/2021,2/19/2021,2/18/2031
2435,Distribution of Improved cook stove - Phase 7,G K Energy Marketers Pvt. Ltd,Energy demand,,AMS-II.G.,Registered,India,"12,999",Asia,6/14/2023,,
2436,Distribution of Improved cook stove - Phase 8,G K Energy Marketers Pvt. Ltd,Energy demand,,AMS-II.G.,Registered,India,"12,627",Asia,10/6/2022,,
2437,Distribution of Improved cook stove - Phase 9,G K Energy Marketers Pvt. Ltd,Energy demand,,AMS-II.G.,Registered,India,"13,196",Asia,12/4/2022,,
2438,Distribution of Improved cook stove - Phase 10,G K Energy Marketers Pvt. Ltd,Energy demand,,AMS-II.G.,Registered,India,"12,619",Asia,9/30/2022,,
2439,Distribution of Improved cook stove - Phase 18,G K Energy Marketers Pvt. Ltd,Energy demand,,AMS-II.G.,Registered,India,"12,945",Asia,1/3/2023,,
2440,Distribution of Improved cook stove - Phase 20,G K Energy Marketers Pvt. Ltd,Energy demand,,AMS-II.G.,Registered,India,"12,855",Asia,12/8/2022,,
2441,Distribution of Improved cook stove - Phase 22,G K Energy Marketers Pvt. Ltd,Energy demand,,AMS-II.G.,Registered,India,"12,766",Asia,1/13/2024,,
2442,Distribution of Improved cook stove - Phase 24,G K Energy Marketers Pvt. Ltd,Energy demand,,AMS-II.G.,Registered,India,"12,675",Asia,12/9/2022,,
2443,Distribution of Improved cook stove - Phase 25,G K Energy Marketers Pvt. Ltd,Energy demand,,AMS-II.G.,Registered,India,"12,810",Asia,11/7/2022,,
2444,Distribution of Improved cook stove - Phase 17,G K Energy Marketers Pvt. Ltd,Energy demand,,AMS-II.G.,Registered,India,"12,945",Asia,12/7/2022,,
2446,Distribution of Improved cook stove - Phase 23,G K Energy Marketers Pvt. Ltd,Energy demand,,AMS-II.G.,Registered,India,"12,945",Asia,12/7/2022,,
2447,Distribution of Improved cook stove - Phase 21,G K Energy Marketers Pvt. Ltd,Energy demand,,AMS-II.G.,Registered,India,"13,035",Asia,12/4/2022,,
2448,Distribution of Improved cook stove - Phase 19,G K Energy Marketers Pvt. Ltd,Energy demand,,AMS-II.G.,Registered,India,"12,900",Asia,2/6/2023,,
2434,Off grid Solar PV project at IAMGOLD Essakane SA Gold Mine,Essakane Solar S.A.S.,Energy industries (renewable/non-renewable sources),,AMS-I.A.,Registered,Burkina Faso,"27,179",Africa,12/7/2021,6/1/2018,5/31/2025
2422,Distribution of Improved cook stove - Phase I,G K Energy Marketers Pvt. Ltd,Energy demand,,AMS-II.G.,Registered,India,"12,644",Asia,12/7/2022,,
2423,Distribution of Improved cook stove - Phase II,G K Energy Marketers Pvt. Ltd,Energy demand,,AMS-II.G.,Registered,India,"12,644",Asia,2/21/2023,,
2424,Distribution of Improved cook stove - Phase III,G K Energy Marketers Pvt. Ltd,Energy demand,,AMS-II.G.,Registered,India,"13,125",Asia,12/8/2022,,
2425,Distribution of Improved cook stove - Phase IV,G K Energy Marketers Pvt. Ltd,Energy demand,,AMS-II.G.,Registered,India,"12,909",Asia,9/30/2022,,
2426,Distribution of improved cook stove- phase V,G K Energy Marketers Pvt. Ltd,Energy demand,,AMS-II.G.,Registered,India,"13,062",Asia,9/30/2022,,
2427,Distribution of Improved cook stove - Phase VI,G K Energy Marketers Pvt. Ltd,Energy demand,,AMS-II.G.,Registered,India,"12,990",Asia,11/9/2021,,
2428,Distribution of Improved cook stove - Phase 14,G K Energy Marketers Pvt. Ltd,Energy demand,,AMS-II.G.,Registered,India,"13,050",Asia,12/7/2022,,
2429,Distribution of Improved cook stove- Phase 15,G K Energy Marketers Pvt. Ltd,Energy demand,,AMS-II.G.,Registered,India,"12,843",Asia,7/31/2023,,
2430,Distribution of Improved cook stove - Phase 16,G K Energy Marketers Pvt. Ltd,Energy demand,,AMS-II.G.,Registered,India,"12,945",Asia,11/7/2022,,
2418,Gansu Lanzhou Afforestation Project,Lanzhou Landscaping And Greening Service Center,Agriculture Forestry and Other Land Use,ARR,AR-ACM0003,Registered,China,"117,640",Asia,12/23/2021,9/13/2016,9/12/2076
2415,Distribution of Improved cook stove - Phase 11,G K Energy Marketers Pvt. Ltd,Energy demand,,AMS-II.G.,Registered,India,"13,428",Asia,11/26/2021,,
2416,Distribution of Improved cook stove - Phase 12,G K Energy Marketers Pvt. Ltd,Energy demand,,AMS-II.G.,Registered,India,"13,930",Asia,12/13/2022,,
2417,Distribution of Improved cook stove - Phase 13,G K Energy Marketers Pvt. Ltd,Energy demand,,AMS-II.G.,Registered,India,"13,420",Asia,12/7/2022,,
2413,Zhangjiakou Zhangbei County 2017 Afforestation Project,"Zhangjiakou Sailin Landscaping Co., Ltd.",Agriculture Forestry and Other Land Use,ARR,AR-ACM0003,Registered,China,"145,879",Asia,3/6/2023,5/12/2017,5/11/2037
2414,Davidson County Landfill,"ANEW ENVIRONMENTAL, LLC",Waste handling and disposal,,Climate Action Reserve Landfill Project Protocol,Registered,United States,"50,000",North America,7/27/2021,1/1/2022,12/31/2028
2412,Mindanao Tree Planting Program for our Climate and Communities (MinTrees),Multiple Proponents,Agriculture Forestry and Other Land Use,ARR,AR-ACM0003,Registered,Philippines,"33,015",Asia,9/28/2022,3/15/2015,3/14/2065
2411,Bosques del Uruguay II (BDU II) Afforestation through High Quality Timber in Grasslands Project,AGRO EMPRESA FORESTAL SA,Agriculture Forestry and Other Land Use,ARR,AR-ACM0003,Registered,Uruguay,"4,066",Latin America,10/14/2021,3/25/2016,3/24/2076
2410,"REFORESTATION OF DEGRADED FOREST RESERVE AREAS IN GHANA, WEST AFRICA",Miro Forestry Developments Limited,Agriculture Forestry and Other Land Use,ARR,AR-ACM0003,Registered,Ghana,"46,229",Africa,3/1/2022,3/24/2016,3/23/2046
2409,Cleaner Cooking Solutions Program,Bridge Carbon SGT Asia Stoves Private Limited,Energy demand; Energy industries (renewable/non-renewable sources),,VMR0006,Registered,Cambodia,"841,424",Asia,11/14/2022,2/21/2022,2/20/2032
2405,Gansu Dingxi Afforestation Project,Dingxi City Chankou Forestry Proving Ground,Agriculture Forestry and Other Land Use,ARR; IFM,AR-ACM0003,Registered,China,"706,810",Asia,11/29/2021,9/22/2016,9/21/2076
2403,Riau Ecosystem Restoration Carbon Project,Multiple Proponents,Agriculture Forestry and Other Land Use,REDD; WRC,VM0007,Registered,Indonesia,"6,870,411",Asia,10/20/2021,6/17/2016,6/16/2073
2404,Reforestation of degraded land by MTPL in India,Mangalam Timber Unit of Mangalam Cement Limited,Agriculture Forestry and Other Land Use,ARR,AR-ACM0001,Registered,India,"146,998",Asia,3/3/2022,6/25/2001,6/24/2031
2402,Linshu Biogas Recovery and Power Generation Project,VPOWER New Energy Technology (LinYi) LTD,Energy industries (renewable/non-renewable sources); Waste handling and disposal,,ACM0014,Registered,China,"359,691",Asia,8/4/2021,9/20/2019,9/19/2026
2401,Reforestation of Degraded Lands in Sierra Leone,Miro Forestry Developments Limited,Agriculture Forestry and Other Land Use,ARR,AR-AM0003,Registered,Sierra Leone,"126,297",Africa,12/23/2021,5/16/2016,5/15/2046
2396,Adjusted Water Management in Rice Cultivation in Nanling County,"Hefei Luyu Agricultural Technology Co., Ltd",Agriculture Forestry and Other Land Use,ALM,AMS-III.AU,Rejected by Administrator,China,"53,558",Asia,9/14/2021,,
2397,Adjusted Water Management in Rice Cultivation in Chizhou City,"Hefei Luyu Agricultural Technology Co., Ltd",Agriculture Forestry and Other Land Use,ALM,AMS-III.AU,Rejected by Administrator,China,"53,539",Asia,9/13/2021,,
2398,Qiantai Adjusted Water Management in Rice Cultivation,"Hefei Luyu Agricultural Technology Co., Ltd",Agriculture Forestry and Other Land Use,ALM,AMS-III.AU,Rejected by Administrator,China,"53,512",Asia,10/20/2021,,
2399,Adjusted Water Management in Rice Cultivation in Wangjiang County and Susong County,"Hefei Luyu Agricultural Technology Co., Ltd",Agriculture Forestry and Other Land Use,ALM,AMS-III.AU,Rejected by Administrator,China,"53,562",Asia,11/10/2021,,
2391,Gansu Tianshui Afforestation Project,Tianshui Forestry Science Institute,Agriculture Forestry and Other Land Use,ARR,AR-ACM0003,Registered,China,"342,003",Asia,6/3/2022,9/21/2016,9/20/2076
2392,REDD + in the Forests of the Otún River Basin,Empresa de Acueducto y Alcantarillado de Pereira S.A.S E.S. P,Agriculture Forestry and Other Land Use,REDD,VM0015,Withdrawn,Colombia,"30,874",Latin America,,1/1/2016,12/31/2045
2390,Installation of high efficiency wood burning cookstoves in Angola,C-Quest Capital Stoves Asia Limited,Energy demand,,VMR0006,Registered,Angola,"2,567,788",Africa,3/6/2023,11/11/2021,11/10/2031
2387,Liugui Afforestation Project,"Guangxi Baixin Agricultural Technology Co., Ltd.",Agriculture Forestry and Other Land Use,ARR,AR-ACM0003,Withdrawn,China,"878,138",Asia,9/2/2021,5/5/2016,5/4/2046
2386,Rotunda Forest Carbon Project,Global Forest Support GmbH,Agriculture Forestry and Other Land Use,IFM,VM0012,Registered,Romania,"5,662",Europe,9/13/2021,1/1/2018,12/31/2047
2384,Recipe for Change Grouped Project,Wonderbag UK,Energy demand,,AMS-II.C.; AMS-II.G.,Registered,South Africa,"103,254",Africa,5/12/2021,3/15/2019,3/14/2026
2385,Carbon fixation project associated with LtPF conservation scenario of riparian strip enlargement,Cree First Nation of Waswanipi.,Agriculture Forestry and Other Land Use,IFM,VM0012,Registration and verification approval request denied,Canada,"7,223",North America,,5/1/2016,4/30/2053
2382,Niger Acacia Senegal Plantation Project,Achats Service International,Agriculture Forestry and Other Land Use,ARR,AR-ACM0003,Registered,Niger,"24,957",Africa,10/25/2021,12/21/2005,12/20/2035
2383,Guizhou Wenjiaba CMM Power Generation Project,"Guizhou Shuikuang Orion Clean Energy Co., Ltd.",Energy industries (renewable/non-renewable sources); Mining/mineral production,,ACM0008,Registered,China,"103,297",Asia,3/31/2022,9/24/2020,9/23/2030
2380,Installation of high efficiency wood burning cookstoves in Rwanda,C-Quest Capital Stoves Asia Limited,Energy industries (renewable/non-renewable sources),,VMR0006,Withdrawn,Rwanda,"3,149,415",Africa,5/11/2023,10/9/2021,10/8/2031
2378,Miaoling Afforestation Project,"Guizhou Xinzhanxin Agricultural Technology Co., Ltd.",Agriculture Forestry and Other Land Use,ARR,AR-ACM0003,Withdrawn,China,"458,449",Asia,8/6/2021,4/20/2016,4/19/2046
2379,Huadu Afforestation Project,"Guizhou Xinzhanxin Agricultural Technology Co., Ltd.",Agriculture Forestry and Other Land Use,ARR,AR-ACM0003,Withdrawn,China,"702,405",Asia,11/5/2021,4/28/2016,4/27/2046
2376,Jilin Lushuihe Afforestation Project,"Jilin Forest Industry Environmental Technology Co., Ltd.",Agriculture Forestry and Other Land Use,ARR,AR-ACM0003,Registration request denied,China,"716,922",Asia,,8/2/2016,8/1/2076
2377,Jilin Wangou Afforestation Project,"Jilin Forest Industry Environmental Technology Co., Ltd.",Agriculture Forestry and Other Land Use,ARR,AR-ACM0003,Rejected by Administrator,China,"558,918",Asia,,8/5/2016,8/4/2076
2375,Jilin Sanchazi Afforestation Project,"Jilin Forest Industry Environmental Technology Co., Ltd.",Agriculture Forestry and Other Land Use,ARR,AR-ACM0003,Registered,China,"10,576",Asia,8/13/2021,8/15/2016,8/14/2076
2371,Installation of high efficiency wood burning cookstoves in Zambia - Project 2,Multiple Proponents,Energy demand,,VMR0006,Withdrawn,Zambia,"1,713,078",Africa,12/11/2021,10/14/2020,10/13/2030
2372,Installation of high efficiency wood burning cookstoves in Malawi - Project 2,Bridge Carbon Africa Stoves Development Private Limited,Energy demand,,VMR0006,Registered,Malawi,"1,924,569",Africa,11/12/2021,7/5/2020,7/4/2030
2373,Yellow Ipê Grouped REDD Project,Ecológica Assessoria Ltda.,Agriculture Forestry and Other Land Use,REDD,VM0015,Registered,Brazil,"540,179",Latin America,12/14/2021,3/1/2020,2/28/2050
2369,Forestal Apepu Carbon Project,Forestal Apepu,Agriculture Forestry and Other Land Use,ARR,AR-ACM0003,Registered,Paraguay,"12,902",Latin America,1/23/2023,6/28/2019,6/27/2039
2370,Zhangye City Afforestation Project in Gansu Province,Zhangye Academy of Forestry Sciences,Agriculture Forestry and Other Land Use,ARR,AR-ACM0003,Registered,China,"238,392",Asia,8/13/2021,5/10/2016,5/9/2076
2366,Installation of high efficiency wood burning cookstoves in Tanzania,Bridge Carbon Africa Stoves Development Private Limited,Energy demand; Energy industries (renewable/non-renewable sources),,VMR0006,Registered,Tanzania,"1,882,271",Africa,12/12/2021,9/23/2020,9/22/2030
2363,CONSERVATION OF MIOMBOS IN TARU  KENYA REDD+,Swiss carbon Value Ltd.,Agriculture Forestry and Other Land Use,REDD,VM0009,Withdrawn,Kenya,"16,225",Africa,,7/1/2016,6/30/2046
2362,Adjusted Water Management in Rice Cultivation in Tongcheng City,"Hefei Luyu Agricultural Technology Co., Ltd",Agriculture Forestry and Other Land Use,ALM,AMS-III.AU,Rejected by Administrator,China,"53,501",Asia,3/9/2021,,
2361,Afforestation in cooperation with local landowners for Forestal San Pedro S.A,Forestal San Pedro S.A.,Agriculture Forestry and Other Land Use,ARR,AR-ACM0003,Registered,Paraguay,"45,549",Latin America,3/29/2022,4/5/2015,4/4/2035
2358,Nanchang Zhonglan Huanneng Technical Service Co. Ltd. Maiyuan LFG Power Generation Project,Nanchang Zhonglan Huanneng Technical Service Co. Ltd.,Energy industries (renewable/non-renewable sources); Waste handling and disposal,,ACM0001,Registered,China,"155,699",Asia,4/10/2021,1/1/2019,12/31/2028
2357,Improved cook stove market development in rural Nepal,Practical Action,Energy demand,,AMS-II.G.,Registered,Nepal,"44,763",Asia,11/23/2021,11/1/2018,10/31/2028
2355,Suzhou Qizishan MSW landfill site redundant LFG recovery to power project,"Suzhou Baichang Renewable Energy Co., Ltd.",Energy industries (renewable/non-renewable sources); Waste handling and disposal,,ACM0001,Registered,China,"40,317",Asia,8/25/2021,12/1/2020,11/30/2030
2352,Shizaiqian MSW landfill site LFG recovery to power project,"Quanzhou BCCY New Energy CO., Ltd.",Energy industries (renewable/non-renewable sources); Waste handling and disposal,,ACM0001,Registered,China,"66,269",Asia,3/8/2022,7/1/2019,6/30/2029
2353,Qingdao Xiaojianxi Phase II MSW landfill site LFG recovery to power project,"Henan BCCY Environmental Energy CO.,LTD.",Energy industries (renewable/non-renewable sources); Waste handling and disposal,,ACM0001,Registered,China,"73,157",Asia,4/30/2021,4/13/2019,4/12/2029
2349,Installation of high efficiency wood burning cookstoves in Kenya,Bridge Carbon Africa Stoves Development Private Limited,Energy demand,,VMR0006,Registered,Kenya,"1,500,000",Africa,5/13/2022,10/6/2020,10/5/2030
2350,Installation of high efficiency wood burning cookstoves in Uganda,Bridge Carbon Africa Stoves Development Private Limited,Energy demand,,VMR0006,Registered,Uganda,"1,459,980",Africa,3/16/2023,12/15/2021,12/14/2031
2351,Installation of high efficiency wood burning cookstoves in Mozambique,Bridge Carbon Africa Stoves Development Private Limited,Energy industries (renewable/non-renewable sources),,VMR0006,Registered,Mozambique,"1,713,078",Africa,5/13/2022,1/27/2021,1/26/2031
2348,Motion Energy EV Industry Charger Project,Motion Energy Group,Transport,,VM0038,Registered,Australia,"20,000",Oceania,4/27/2022,1/1/2021,12/31/2027
